{
  "id": "react-ui:invokes_api:react-ui:ui_control:ImportPage.submit:compose:http_endpoint:POST /projects",
  "project_id": "11111111-1111-1111-1111-111111111111",
  "analysis_run_id": "22222222-2222-2222-2222-222222222222",
  "parser_id": "react-ui",
  "language": "typescript",
  "from": "react-ui:ui_control:ImportPage.submit",
  "to": "ts-api-routes:http_endpoint:POST /projects",
  "type": "invokes_api",
  "path": "frontend/src/pages/ImportPage.tsx",
  "location": { "start_line": 40, "start_col": 0, "end_line": 55, "end_col": 1 },
  "metadata": {
    "layer": "ui",
    "http_method": "POST",
    "path_template": "/projects",
    "body_fields": ["source_type", "source_value", "name"]
  },
  "ingested_at": "2026-07-22T00:00:00.000Z"
}
